### ISSUE TITLE
microk8s + multipass + macOS + metallb: does not respond to ARP requests

### ISSUE THREAD

**Issue by candlerb** [ubuntu/microk8s#908]
Summary: when running metallb on a two node microk8s cluster under macOS+multipass, ARP responses do not get through, and hence connections cannot be established.

I think this is probably an issue with hyperkit or how multipass configures hyperkit, as I was able to get microk8s+metallb to work on two physical nodes successfully.

## Multipass

Running two multipass VMs on macOS 10.14.6

```
$ multipass version
multipass  1.0.0+mac
multipassd 1.0.0+mac
$ multipass list
Name                    State             IPv4             Image
microk8s-vm1            Running           192.168.64.4     Ubuntu 18.04 LTS
microk8s-vm2            Running           192.168.64.3     Ubuntu 18.04 LTS
$ multipass info --all
Name:           microk8s-vm1
State:          Running
IPv4:           192.168.64.4
Release:        Ubuntu 18.04.3 LTS
Image hash:     a720c34066dc (Ubuntu 18.04 LTS)
Load:           1.66 1.00 0.94
Disk usage:     2.6G out of 38.6G
Memory usage:   699.4M out of 3.9G

Name:           microk8s-vm2
State:          Running
IPv4:           192.168.64.3
Release:        Ubuntu 18.04.3 LTS
Image hash:     a720c34066dc (Ubuntu 18.04 LTS)
Load:           0.62 0.56 0.34
Disk usage:     2.5G out of 38.6G
Memory usage:   336.3M out of 3.9G
```

## microk8s

```
ubuntu@microk8s-vm1:~$ microk8s.kubectl version
Client Version: version.Info{Major:"1", Minor:"17", GitVersion:"v1.17.0", GitCommit:"70132b0f130acc0bed193d9ba59dd186f0e634cf", GitTreeState:"clean", BuildDate:"2019-12-07T21:20:10Z", GoVersion:"go1.13.4", Compiler:"gc", Platform:"linux/amd64"}
Server Version: version.Info{Major:"1", Minor:"17", GitVersion:"v1.17.0", GitCommit:"70132b0f130acc0bed193d9ba59dd186f0e634cf", GitTreeState:"clean", BuildDate:"2019-12-07T21:12:17Z", GoVersion:"go1.13.4", Compiler:"gc", Platform:"linux/amd64"}
ubuntu@microk8s-vm1:~$ microk8s.kubectl get node
NAME           STATUS   ROLES    AGE   VERSION
192.168.64.3   Ready    <none>   22h   v1.17.0
microk8s-vm1   Ready    <none>   22h   v1.17.0
```

microk8s installed in both, second (192.168.64.3 / microk8s-vm2) joined to first (192.168.64.4 / microk8s-vm1).

## metallb

Enabled with `microk8s.enable metallb`. When prompted I gave it range `192.168.64.240-192.168.64.249` which is on the same subnet as the VMs.

Then created a load balance service.  External IP has been picked from the correct range.

```
$ kubectl describe service www4
Name:                     www4
Namespace:                default
Labels:                   <none>
Annotations:              kubectl.kubernetes.io/last-applied-configuration:
                            {"apiVersion":"v1","kind":"Service","metadata":{"annotations":{},"name":"www4","namespace":"default"},"spec":{"ports":[{"port":8888,"proto...
Selector:                 app=nginx
Type:                     LoadBalancer
IP:                       10.152.183.35
LoadBalancer Ingress:     192.168.64.240
Port:                     <unset>  8888/TCP
TargetPort:               80/TCP
NodePort:                 <unset>  30755/TCP
Endpoints:                10.1.77.3:80
Session Affinity:         None
External Traffic Policy:  Cluster
Events:
  Type    Reason        Age                 From             Message
  ----    ------        ----                ----             -------
  Normal  nodeAssigned  15m (x9 over 146m)  metallb-speaker  announcing from node "192.168.64.3"
```

On the first node (192.168.64.4):

```
ubuntu@microk8s-vm1:~$ sudo arping 192.168.64.240
ARPING 192.168.64.240
Timeout
Timeout
Timeout
^C
```

Then repeated this test, while running `sudo tcpdump -i enp0s2 -nn arp or icmp` on both nodes. The first node shows only outgoing ARPs:

```
ubuntu@microk8s-vm1:~$ sudo tcpdump -i enp0s2 -nn arp or icmp
tcpdump: verbose output suppressed, use -v or -vv for full protocol decode
listening on enp0s2, link-type EN10MB (Ethernet), capture size 262144 bytes
20:49:22.134656 ARP, Request who-has 192.168.64.240 tell 192.168.64.4, length 44
20:49:23.156960 ARP, Request who-has 192.168.64.240 tell 192.168.64.4, length 44
20:49:24.188428 ARP, Request who-has 192.168.64.240 tell 192.168.64.4, length 44
20:49:25.191662 ARP, Request who-has 192.168.64.240 tell 192.168.64.4, length 44
```

But the second node shows both inbound and response:

```
ubuntu@microk8s-vm2:~$ sudo tcpdump -i enp0s2 -nn arp or icmp
tcpdump: verbose output suppressed, use -v or -vv for full protocol decode
listening on enp0s2, link-type EN10MB (Ethernet), capture size 262144 bytes
20:49:22.131648 ARP, Request who-has 192.168.64.240 tell 192.168.64.4, length 46
20:49:22.132264 ARP, Reply 192.168.64.240 is-at e6:71:5c:3b:46:5d, length 46
20:49:23.153703 ARP, Request who-has 192.168.64.240 tell 192.168.64.4, length 46
20:49:23.154209 ARP, Reply 192.168.64.240 is-at e6:71:5c:3b:46:5d, length 46
20:49:24.184884 ARP, Request who-has 192.168.64.240 tell 192.168.64.4, length 46
20:49:24.185394 ARP, Reply 192.168.64.240 is-at e6:71:5c:3b:46:5d, length 46
20:49:25.187788 ARP, Request who-has 192.168.64.240 tell 192.168.64.4, length 46
20:49:25.189072 ARP, Reply 192.168.64.240 is-at e6:71:5c:3b:46:5d, length 46
```

It therefore seems that the ARP replies are getting blocked somehow.

I get the same results if I ARP from the host macOS machine:

```
$ sudo arping 192.168.64.240
Password:
ARPING 192.168.64.240
Timeout
Timeout
Timeout
^C
```

tcpdump on vm2:

```
ubuntu@microk8s-vm2:~$ sudo tcpdump -i enp0s2 -nn arp or icmp
tcpdump: verbose output suppressed, use -v or -vv for full protocol decode
listening on enp0s2, link-type EN10MB (Ethernet), capture size 262144 bytes
20:55:28.372356 ARP, Request who-has 192.168.64.240 tell 192.168.64.1, length 44
20:55:28.372663 ARP, Reply 192.168.64.240 is-at e6:71:5c:3b:46:5d, length 46
20:55:29.375740 ARP, Request who-has 192.168.64.240 tell 192.168.64.1, length 44
20:55:29.376330 ARP, Reply 192.168.64.240 is-at e6:71:5c:3b:46:5d, length 46
20:55:30.378428 ARP, Request who-has 192.168.64.240 tell 192.168.64.1, length 44
20:55:30.378824 ARP, Reply 192.168.64.240 is-at e6:71:5c:3b:46:5d, length 46
```

Of course, ARPs from the host macOS machine to the vm's native IP address are fine:

```
$ sudo arping 192.168.64.3
ARPING 192.168.64.3
60 bytes from e6:71:5c:3b:46:5d (192.168.64.3): index=0 time=263.000 usec
60 bytes from e6:71:5c:3b:46:5d (192.168.64.3): index=1 time=371.000 usec
```

**Comment by candlerb** [comment]
```
ubuntu@microk8s-vm1:~$ microk8s.inspect
Inspecting services
  Service snap.microk8s.daemon-cluster-agent is running
  Service snap.microk8s.daemon-flanneld is running
  Service snap.microk8s.daemon-containerd is running
  Service snap.microk8s.daemon-apiserver is running
  Service snap.microk8s.daemon-apiserver-kicker is running
  Service snap.microk8s.daemon-proxy is running
  Service snap.microk8s.daemon-kubelet is running
  Service snap.microk8s.daemon-scheduler is running
  Service snap.microk8s.daemon-controller-manager is running
  Service snap.microk8s.daemon-etcd is running
  Copy service arguments to the final report tarball
Inspecting AppArmor configuration
Gathering system information
  Copy processes list to the final report tarball
  Copy snap list to the final report tarball
  Copy VM name (or none) to the final report tarball
  Copy disk usage information to the final report tarball
  Copy memory usage information to the final report tarball
  Copy server uptime to the final report tarball
  Copy current linux distribution to the final report tarball
  Copy openSSL information to the final report tarball
  Copy network configuration to the final report tarball
Inspecting kubernetes cluster
  Inspect kubernetes cluster

Building the report tarball
  Report tarball is at /var/snap/microk8s/1107/inspection-report-20200111_205717.tar.gz
```

I can upload the report tarball somewhere if required.

**Comment by balchua** [comment]
Should this be better reported to metallb project team too?

**Comment by candlerb** [comment]
After some more testing, I think the problem lies with multipass/hyperkit.

The fundamental question is: does it filter traffic from VM NICs to only the expected IP addresses?  This is something I can test easily enough:

```
ubuntu@microk8s-vm2:~$ sudo ip addr add 192.168.64.123/24 dev enp0s2

ubuntu@microk8s-vm1:~$ sudo arping 192.168.64.123
ARPING 192.168.64.123
Timeout
Timeout
Timeout
^C

ubuntu@microk8s-vm2:~$ sudo tcpdump -i enp0s2 -nn arp or icmp
tcpdump: verbose output suppressed, use -v or -vv for full protocol decode
listening on enp0s2, link-type EN10MB (Ethernet), capture size 262144 bytes
12:09:37.281277 ARP, Request who-has 192.168.64.123 tell 192.168.64.4, length 46
12:09:37.281308 ARP, Reply 192.168.64.123 is-at e6:71:5c:3b:46:5d, length 28
12:09:38.283860 ARP, Request who-has 192.168.64.123 tell 192.168.64.4, length 46
12:09:38.283905 ARP, Reply 192.168.64.123 is-at e6:71:5c:3b:46:5d, length 28
12:09:39.286216 ARP, Request who-has 192.168.64.123 tell 192.168.64.4, length 46
12:09:39.286263 ARP, Reply 192.168.64.123 is-at e6:71:5c:3b:46:5d, length 28
```

OK, that makes it pretty certain the problem is with filtering in multipass/hyperkit.  The ARP broadcasts get through, the unicast ARP replies don't.  And this is independent of metallb.

The solution *might* be for multipass to configure virtual NICs or bridge in hyperkit slightly differently.  Or it may be a fundamental limitation of hyperkit / hypervisor.framework which can't be overridden.

I reported the issue here because microk8s is the project which bundles both multipass and metallb - the former in its installation instructions, and the latter via `microk8s.enable`.  If there's no obvious solution, maybe it's just a question of updating the microk8s documentation to say "metallb doesn't work when you are using multipass on macOS"

**Comment by candlerb** [comment]
Checked multipass's [troubleshooting networking on macOS](https://multipass.run/docs/troubleshooting-networking-on-macos) - this issue is not listed there.

Given this is something I can now reproduce with multipass alone, I guess I should create a ticket on that.

**Comment by balchua** [comment]
@candlerb thanks for the information provided.  @ktsakalozos is this something we can get help from multipass team?

**Comment by ktsakalozos** [comment]
@candlerb, thank you for reporting this and for opening an issue with multipass. There is also the https://discourse.ubuntu.com/c/multipass forum where you can find support.
